{
  "$schema": "https://json-schema.org/draft/2020-12/schema",
  "title": "A-Team goal tree",
  "description": "One primitive: the goal. Milestones, tickets and code-level tasks differ only in altitude, not in kind. A goal is a leaf when its acceptance criteria are observable by a nameable check. Nodes are stored flat with parent pointers so the tree diffs cleanly in git.",
  "type": "object",
  "required": ["root", "generated_at", "source", "nodes"],
  "additionalProperties": false,
  "properties": {
    "root": { "type": "string", "description": "id of the root goal" },
    "generated_at": { "type": "string" },
    "source": {
      "type": "object",
      "required": ["repo"],
      "properties": {
        "repo": { "type": "string" },
        "milestone_file": { "type": "string" },
        "commit": { "type": "string" }
      }
    },
    "nodes": {
      "type": "array",
      "minItems": 1,
      "items": { "$ref": "#/$defs/node" }
    }
  },
  "$defs": {
    "node": {
      "type": "object",
      "required": ["id", "parent", "title", "outcome", "criteria", "leaf", "owner"],
      "additionalProperties": false,
      "properties": {
        "id": {
          "type": "string",
          "pattern": "^[A-Za-z0-9-]+(\\.[0-9]+)*$",
          "description": "dotted path, e.g. M-1, M-1.2, M-1.2.3 — position in the tree is readable from the id"
        },
        "parent": { "type": ["string", "null"] },
        "title": { "type": "string", "minLength": 3 },
        "outcome": {
          "type": "string",
          "minLength": 10,
          "description": "one sentence: the observable end state, not the activity"
        },
        "criteria": {
          "type": "array",
          "minItems": 1,
          "items": { "$ref": "#/$defs/criterion" },
          "description": "every level has criteria. A parent's criteria are the integration check that its children being green does not guarantee."
        },
        "leaf": {
          "type": "boolean",
          "description": "true when every criterion carries a check with type != 'undecidable'"
        },
        "owner": {
          "type": "string",
          "enum": ["agent", "human"],
          "description": "human = the PO/PM must decide or perform this; the agent may not resolve it alone. Scan the tree for these: they are the control surface."
        },
        "why_not_leaf": {
          "type": "string",
          "description": "required when leaf=false: which criterion cannot be checked without further decomposition"
        },
        "est_minutes": { "type": "integer", "minimum": 1 },
        "depends_on": {
          "type": "array",
          "items": { "type": "string" },
          "description": "sibling or cousin ids that must complete first. Ordering, not decomposition."
        },
        "notes": { "type": "string" }
      }
    },
    "criterion": {
      "type": "object",
      "required": ["id", "statement", "check"],
      "additionalProperties": false,
      "properties": {
        "id": { "type": "string" },
        "statement": {
          "type": "string",
          "description": "a claim that is true or false about the finished state. Not a task."
        },
        "check": { "$ref": "#/$defs/check" }
      }
    },
    "check": {
      "type": "object",
      "required": ["type", "how"],
      "additionalProperties": false,
      "properties": {
        "type": {
          "type": "string",
          "enum": ["command", "ui", "process", "measurement", "undecidable"],
          "description": "command = runs, exit code or output decides. ui = a human or screenshot observes a named element/state. process = a named flow is run end to end. measurement = a number crosses a stated threshold. undecidable = cannot be checked without decomposing; forces leaf=false."
        },
        "how": {
          "type": "string",
          "description": "the exact command, the exact screen and element, the exact flow, or the exact metric and threshold. Never 'verify that it works'."
        },
        "expect": { "type": "string", "description": "the passing result" }
      }
    }
  }
}
