{
  "root": "TR-1",
  "generated_at": "2026-07-20T21:40:00+02:00",
  "source": {
    "repo": "/Users/rp/Dev/progos/a-team",
    "milestone_file": "schemas/ticket.md",
    "commit": "3892c0d"
  },
  "nodes": [
    {
      "id": "TR-1",
      "parent": null,
      "title": "Minden ticketről látszik, van-e elég követelménye a végrehajtáshoz",
      "outcome": "Egy parancs ticketenként kiírja, hiányzik-e a végrehajtáshoz szükséges hat szakasz vagy a story point valamelyike, és pontosan melyik.",
      "criteria": [
        {
          "id": "c1",
          "statement": "A parancs mind a 13 ticketre ad ítéletet, és a hiányokat névvel nevezi meg.",
          "check": {
            "type": "command",
            "how": "python3 skills/ready/ready.py | tee /tmp/ready.out | wc -l; grep -E '^AT-6' /tmp/ready.out",
            "expect": "13 sornyi ticket-ítélet; az AT-6 sora ⛔, és felsorolja: Scope, Out of scope, Acceptance criteria, Verification, Dependencies, story_points"
          }
        },
        {
          "id": "c2",
          "statement": "Az ítélet a ticket tényleges tartalmából jön, nem beégetett listából.",
          "check": {
            "type": "process",
            "how": "A GH-1 ticketből töröld a `## Verification` szakaszt, futtasd újra a parancsot, majd `git checkout a-team/tickets/GH-1-interrupted-sprint-closure.md` és futtasd megint.",
            "expect": "elsőre GH-1 ⛔ és a hiányok között ott van a Verification; visszaállítás után újra ✅"
          }
        }
      ],
      "leaf": false,
      "owner": "agent",
      "why_not_leaf": "c1 nem figyelhető meg, amíg a parancs nem létezik; a parancs négy külön megfigyelhető részből áll.",
      "notes": "A cél az 1-es stopnál jóváhagyott mondat: 'Minden ticketről egy pillantásra látszik, van-e elég követelménye ahhoz, hogy az agent kérdés nélkül végigvigye — és ha nincs, pontosan mi hiányzik belőle.' Futamméret: egy este. A jelenlegi valóság a 3892c0d commitnál: 13 ticketből 4 teljes (AT-1, GH-1, TEMP-20260719-01, TEMP-20260719-02)."
    },

    {
      "id": "TR-1.1",
      "parent": "TR-1",
      "title": "A követelménylista egy helyen van, gépnek olvasható alakban",
      "outcome": "A hat kötelező szakasz és a story_points mező egyetlen adatfájlban áll, nem prózában és nem kódba drótozva, hogy később típusfüggő szabállyal bővíthető legyen.",
      "criteria": [
        {
          "id": "c1",
          "statement": "A követelménylista adat, amit egy új sorral bővíteni lehet kódmódosítás nélkül.",
          "check": {
            "type": "undecidable",
            "how": "A fájl formátuma és helye még nincs kiválasztva; a bővíthetőség csak konkrét formátum ellen figyelhető meg.",
            "expect": "külön futamban bontjuk"
          }
        }
      ],
      "leaf": false,
      "owner": "agent",
      "why_not_leaf": "külön futamban bontjuk",
      "notes": "Ma este ez a TR-1.2 belsejében adatszerkezetként valósul meg (lásd TR-1.2 notes). Önálló, verziózott szerződéssé emelése az a futam, amelyik a típusfüggő követelményt (TR-1.5) is kiszolgálja."
    },

    {
      "id": "TR-1.2",
      "parent": "TR-1",
      "title": "Egy parancs végignézi a tickteket és kiírja a hiányt",
      "outcome": "A `python3 skills/ready/ready.py` beolvassa az összes ticketfájlt, és ticketenként egy sorban megnevezi a hiányzó kötelező szakaszokat és mezőket.",
      "criteria": [
        {
          "id": "c1",
          "statement": "A parancs egyetlen futásból ad teljes képet: minden ticket szerepel, minden hiány néven nevezve.",
          "check": {
            "type": "command",
            "how": "python3 skills/ready/ready.py",
            "expect": "13 sor; a 4 teljes ticket (AT-1, GH-1, TEMP-20260719-01, TEMP-20260719-02) ✅, a többi ⛔ hiánylistával"
          }
        }
      ],
      "leaf": false,
      "owner": "agent",
      "why_not_leaf": "A beolvasás, a hiánymegnevezés, a kimenet alakja és a hibatűrés négy külön megfigyelhető állítás.",
      "notes": "A hat kötelező szakasz a 6-os stopnál jóváhagyva: Outcome, Scope, Out of scope, Acceptance criteria, Verification, Dependencies — plusz a nem üres story_points frontmatter mező. A Why, a Context és a Result szándékosan nem kötelező; a Result a schemas/ticket.md szerint lezárásig üres. A szabálylista a szkriptben is adatként (lista/dict) áll, nem elszórt if-ekben — ez tartja nyitva a TR-1.1 és TR-1.5 útját."
    },
    {
      "id": "TR-1.2.1",
      "parent": "TR-1.2",
      "title": "A parancs megtalálja és beolvassa mind a 13 tickettet",
      "outcome": "A parancs az `a-team/tickets/*.md` fájlokból kiolvassa a frontmattert és a `## ` szakaszcímeket, és minden fájlról ad egy sort.",
      "criteria": [
        {
          "id": "c1",
          "statement": "A kimenet pontosan annyi ticket-sort tartalmaz, ahány ticketfájl van a mappában.",
          "check": {
            "type": "command",
            "how": "test \"$(python3 skills/ready/ready.py | grep -cE '^(AT|GH|TEMP)-')\" = \"$(ls a-team/tickets/*.md | wc -l | tr -d ' ')\"; echo $?",
            "expect": "0"
          }
        },
        {
          "id": "c2",
          "statement": "Minden ticket azonosítója szerepel a kimenetben, egy sem esik ki csendben.",
          "check": {
            "type": "command",
            "how": "python3 skills/ready/ready.py > /tmp/r.out; for f in a-team/tickets/*.md; do id=$(grep -m1 '^id:' \"$f\" | cut -d' ' -f2); grep -q \"^$id\" /tmp/r.out || echo \"HIÁNYZIK: $id\"; done",
            "expect": "üres kimenet"
          }
        }
      ],
      "leaf": true,
      "owner": "agent",
      "est_minutes": 15,
      "notes": "ember: 2 perc (a kimenet átfutása). Nulla függőség: csak a python3 standard könyvtára, a frontmatter kézzel parse-olva, a repó validate.py / runway.py mintájára."
    },
    {
      "id": "TR-1.2.2",
      "parent": "TR-1.2",
      "title": "Ticketenként megnevezi a hiányzó szakaszokat és mezőket",
      "outcome": "Minden ⛔ sor felsorolja, pontosan melyik a hat kötelező szakaszból és a story_points mezőből hiányzik.",
      "criteria": [
        {
          "id": "c1",
          "statement": "Az AT-6 sora mind a hat hiányát megnevezi, a story pontot is beleértve.",
          "check": {
            "type": "command",
            "how": "python3 skills/ready/ready.py | grep '^AT-6'",
            "expect": "⛔ jelölés, és a sorban szerepel: Scope, Out of scope, Acceptance criteria, Verification, Dependencies, story_points"
          }
        },
        {
          "id": "c2",
          "statement": "A teljes ticketek üres hiánylistát kapnak, és nem kapnak hamis hiányt.",
          "check": {
            "type": "command",
            "how": "python3 skills/ready/ready.py | grep -E '^(AT-1|GH-1|TEMP-20260719-01|TEMP-20260719-02) '",
            "expect": "mind a négy sor ✅, hiánylista nélkül"
          }
        },
        {
          "id": "c3",
          "statement": "A nem kötelező szakaszok hiánya sosem jelenik meg hiányként.",
          "check": {
            "type": "command",
            "how": "python3 skills/ready/ready.py | grep -E 'Why|Context|Result'",
            "expect": "üres kimenet — a három nem kötelező szakasz neve sehol nem szerepel a hiányok között"
          }
        }
      ],
      "leaf": true,
      "owner": "agent",
      "est_minutes": 25,
      "depends_on": ["TR-1.2.1"],
      "notes": "ember: 5 perc (a hiánylisták kiszúrópróbás összevetése két tickettel). A c3 azért kell, mert a schemas/ticket.md kilenc szakaszt sorol fel; a hatra szűkítés a 6-os stop jóváhagyott döntése, és pont ez az, amit egy figyelmetlen implementáció visszacsempészne."
    },
    {
      "id": "TR-1.2.3",
      "parent": "TR-1.2",
      "title": "A kimenet egy pillantásra olvasható",
      "outcome": "A ⛔ sorok elöl állnak, a ✅ sorok hátul, és minden ticket egyetlen sort foglal.",
      "criteria": [
        {
          "id": "c1",
          "statement": "A kimenetben egyetlen ✅ sor sem előzi meg ⛔ sort.",
          "check": {
            "type": "command",
            "how": "python3 skills/ready/ready.py | grep -nE '⛔|✅' | awk -F: '/✅/{seen=1} /⛔/{if(seen) print \"SORREND HIBA: \" $0}'",
            "expect": "üres kimenet"
          }
        },
        {
          "id": "c2",
          "statement": "Egy ticket egy sor — a leghosszabb hiánylista sem törik több sorba.",
          "check": {
            "type": "measurement",
            "how": "python3 skills/ready/ready.py | grep -cE '^(AT|GH|TEMP)-' és a teljes sorszám összevetése",
            "expect": "a ticket-sorok száma 13, és a teljes kimenet legfeljebb 15 sor (13 ticket + legfeljebb 2 sor összegzés)"
          }
        }
      ],
      "leaf": true,
      "owner": "agent",
      "est_minutes": 10,
      "depends_on": ["TR-1.2.2"],
      "notes": "ember: 3 perc (ránézés: tényleg egy pillantás-e). Ez az a levél, ahol a 'ránézek és látom' állítás megfigyelhetővé válik: rendezés + sorszám, nem esztétikai ítélet."
    },
    {
      "id": "TR-1.2.4",
      "parent": "TR-1.2",
      "title": "Sérült vagy nem-ticket fájlon sem áll meg",
      "outcome": "Egy üres vagy frontmatter nélküli .md fájl a tickets mappában nem szakítja meg a futást; a fájl megjelölve szerepel a kimenetben.",
      "criteria": [
        {
          "id": "c1",
          "statement": "Üres .md fájl mellett a parancs végigfut és nullával tér vissza.",
          "check": {
            "type": "command",
            "how": ": > a-team/tickets/ZZZ-empty.md; python3 skills/ready/ready.py; echo \"exit=$?\"; rm a-team/tickets/ZZZ-empty.md",
            "expect": "exit=0, és a 13 valódi ticket sora változatlanul megjelenik"
          }
        },
        {
          "id": "c2",
          "statement": "A sérült fájl nem tűnik el csendben — külön megjelölve látszik.",
          "check": {
            "type": "command",
            "how": ": > a-team/tickets/ZZZ-empty.md; python3 skills/ready/ready.py | grep ZZZ-empty; rm a-team/tickets/ZZZ-empty.md",